{
  "name": "ai-application-delivery",
  "version": "0.3.0",
  "description": "A fail-closed delivery workflow for AI applications with explicit AI quality, safety, and operational evaluation.",
  "startState": "Requirements",
  "terminalStates": [
    "Done",
    "Blocked"
  ],
  "defaultFailureState": "Blocked",
  "failClosed": true,
  "states": [
    {
      "name": "Requirements",
      "gate": {
        "name": "requirements-review",
        "blocking": true,
        "requiredCapabilities": [
          "requirements.elicit",
          "requirements.define-acceptance-criteria"
        ],
        "requiredArtifacts": [
          "Requirements"
        ]
      }
    },
    {
      "name": "Architect",
      "gate": {
        "name": "architecture-review",
        "blocking": true,
        "requiredCapabilities": [
          "architecture.design",
          "architecture.evaluate-tradeoffs"
        ],
        "requiredArtifacts": [
          "ArchitectureDecision"
        ]
      }
    },
    {
      "name": "Implementer",
      "gate": {
        "name": "implementation-complete",
        "blocking": true,
        "requiredCapabilities": [
          "implementation.code",
          "implementation.refactor",
          "implementation.update-tests"
        ],
        "requiredArtifacts": [
          "ImplementationReport"
        ]
      }
    },
    {
      "name": "AIEvaluator",
      "gate": {
        "name": "ai-evaluation-review",
        "blocking": true,
        "requiredCapabilities": [
          "ai.evaluate-quality",
          "ai.evaluate-safety",
          "ai.evaluate-operational-risks"
        ],
        "requiredArtifacts": [
          "AIEvaluationReport"
        ]
      }
    },
    {
      "name": "TestRunner",
      "gate": {
        "name": "test-review",
        "blocking": true,
        "requiredCapabilities": [
          "test.run",
          "test.report",
          "test.diagnose-failure"
        ],
        "requiredArtifacts": [
          "TestReport"
        ]
      }
    },
    {
      "name": "CodeReviewer",
      "gate": {
        "name": "code-review",
        "blocking": true,
        "requiredCapabilities": [
          "review.clean-code",
          "review.tests",
          "review.security"
        ],
        "requiredArtifacts": [
          "CodeReview"
        ]
      }
    },
    {
      "name": "QA",
      "gate": {
        "name": "qa-review",
        "blocking": true,
        "requiredCapabilities": [
          "qa.verify-acceptance-criteria",
          "qa.validate-evidence"
        ],
        "requiredArtifacts": [
          "QAReport"
        ]
      }
    },
    {
      "name": "Done",
      "terminal": true
    },
    {
      "name": "Blocked",
      "terminal": true
    }
  ],
  "transitions": [
    {
      "from": "Requirements",
      "to": "Architect",
      "on": "pass"
    },
    {
      "from": "Requirements",
      "to": "Blocked",
      "on": "fail"
    },
    {
      "from": "Requirements",
      "to": "Blocked",
      "on": "blocked"
    },
    {
      "from": "Architect",
      "to": "Implementer",
      "on": "pass"
    },
    {
      "from": "Architect",
      "to": "Blocked",
      "on": "fail"
    },
    {
      "from": "Architect",
      "to": "Blocked",
      "on": "blocked"
    },
    {
      "from": "Implementer",
      "to": "AIEvaluator",
      "on": "pass"
    },
    {
      "from": "Implementer",
      "to": "Blocked",
      "on": "fail"
    },
    {
      "from": "Implementer",
      "to": "Blocked",
      "on": "blocked"
    },
    {
      "from": "AIEvaluator",
      "to": "TestRunner",
      "on": "pass"
    },
    {
      "from": "AIEvaluator",
      "to": "Implementer",
      "on": "fail"
    },
    {
      "from": "AIEvaluator",
      "to": "Blocked",
      "on": "blocked"
    },
    {
      "from": "TestRunner",
      "to": "CodeReviewer",
      "on": "pass"
    },
    {
      "from": "TestRunner",
      "to": "Implementer",
      "on": "fail"
    },
    {
      "from": "TestRunner",
      "to": "Blocked",
      "on": "blocked"
    },
    {
      "from": "CodeReviewer",
      "to": "QA",
      "on": "pass"
    },
    {
      "from": "CodeReviewer",
      "to": "Implementer",
      "on": "fail"
    },
    {
      "from": "CodeReviewer",
      "to": "Blocked",
      "on": "blocked"
    },
    {
      "from": "QA",
      "to": "Done",
      "on": "pass"
    },
    {
      "from": "QA",
      "to": "Blocked",
      "on": "fail"
    },
    {
      "from": "QA",
      "to": "Blocked",
      "on": "blocked"
    }
  ]
}
